{
  "university_id": "dongguk",
  "university": "동국대학교",
  "region": "서울",
  "tracks": [
    {
      "track_id": "dongguk_susi_gihoe",
      "track_name": "학생부교과(기회균형통합)",
      "phase": "susi",
      "admission_basis": "학생부교과",
      "rural_type": "included",
      "rural_eligible_groups": ["국가보훈대상자", "농어촌학생", "기초생활수급자 및 차상위계층", "서해5도학생", "자립지원대상자"],
      "selection_elements": ["학생부교과 70%", "서류(서류종합평가) 30%"],
      "has_interview": false,
      "interview_note": "없음",
      "csat_minimum": false,
      "csat_minimum_detail": "미적용",
      "unit_note": "정원 외 134명. 국가보훈·농어촌·기초차상위·서해5도·자립지원 통합 전형. 농어촌 단독 인원 미상.",
      "description": "수시 학생부교과 기회균형통합전형(정원 외). 교과70%+서류30%, 수능최저 없음. 5개 그룹 통합 134명."
    },
    {
      "track_id": "dongguk_jeongsi_rural",
      "track_name": "수능(농어촌학생)",
      "phase": "jeongsi",
      "admission_basis": "수능",
      "rural_type": "standalone",
      "rural_eligible_groups": ["농어촌학생"],
      "selection_elements": ["수능 100%"],
      "has_interview": false,
      "interview_note": "없음",
      "csat_minimum": false,
      "csat_minimum_detail": "미적용",
      "unit_note": "정원 외 94명. 가군 39명·나군 45명·다군 10명 (모집단위별 군 상이).",
      "description": "정시 농어촌학생 단독 전형(정원 외). 수능100%, 수능최저 없음. 가군 39+나군 45+다군 10=94명."
    }
  ]
}
