{
  "university_id": "sungshin",
  "university": "성신여자대학교",
  "region": "서울",
  "tracks": [
    {
      "track_id": "sungshin_susi_gihoe",
      "track_name": "학생부종합(기회균형Ⅰ전형)",
      "phase": "susi",
      "admission_basis": "학생부종합",
      "rural_type": "included",
      "rural_eligible_groups": ["국가보훈대상자", "농어촌학생", "특성화고교출신자"],
      "selection_elements": ["서류(학생부) 100%"],
      "has_interview": false,
      "interview_note": "없음",
      "csat_minimum": false,
      "csat_minimum_detail": "미적용",
      "unit_note": "정원 내 110명. 국가보훈·농어촌·특성화고 3개 그룹 통합 전형. 농어촌 단독 인원 미상.",
      "description": "수시 학생부종합 기회균형Ⅰ전형(정원 내). 서류(학생부)100% 일괄합산, 수능최저 없음. 3개 그룹 통합 110명."
    },
    {
      "track_id": "sungshin_jeongsi_rural",
      "track_name": "수능(농어촌학생전형)",
      "phase": "jeongsi",
      "admission_basis": "수능",
      "rural_type": "standalone",
      "rural_eligible_groups": ["농어촌학생"],
      "selection_elements": ["수능 100%"],
      "has_interview": false,
      "interview_note": "없음",
      "csat_minimum": false,
      "csat_minimum_detail": "미적용",
      "unit_note": "정원 외 68명. 가군 25명·나군 43명. 6년형·12년형 모두 허용. 농어촌 소재 특성화고·특목고 재학 사실 있으면 지원 불가.",
      "description": "정시 수능 농어촌학생전형(정원 외). 수능100%, 수능최저 없음. 가군 25+나군 43=68명."
    }
  ]
}
