{
  "university_id": "sejong",
  "university": "세종대학교",
  "region": "서울",
  "tracks": [
    {
      "track_id": "sejong_susi_gihoe",
      "track_name": "학생부종합(기회균형전형)",
      "phase": "susi",
      "admission_basis": "학생부종합",
      "rural_type": "included",
      "rural_eligible_groups": ["국가보훈대상자", "기초생활수급자 및 차상위계층 및 한부모", "농어촌학생", "특성화고교 졸업자", "만학도", "북한이탈주민"],
      "selection_elements": ["서류 100%"],
      "has_interview": false,
      "interview_note": "없음",
      "csat_minimum": false,
      "csat_minimum_detail": "미적용",
      "unit_note": "정원 내 99명. 국가보훈·기초차상위한부모·농어촌·특성화고·만학도·북한이탈주민 통합 전형. 농어촌 단독 인원 미상.",
      "description": "수시 학생부종합 기회균형전형(정원 내). 서류100%, 수능최저 없음. 6개 그룹 통합 99명."
    },
    {
      "track_id": "sejong_jeongsi_rural",
      "track_name": "수능(농어촌학생전형)",
      "phase": "jeongsi",
      "admission_basis": "수능",
      "rural_type": "standalone",
      "rural_eligible_groups": ["농어촌학생"],
      "selection_elements": ["수능 100%"],
      "has_interview": false,
      "interview_note": "없음",
      "csat_minimum": false,
      "csat_minimum_detail": "미적용",
      "unit_note": "정원 외 41명. 가군 28명·나군 13명. 다군은 수시 미충원 이월만.",
      "description": "정시 농어촌학생 단독 전형(정원 외). 수능100%, 수능최저 없음. 가군 28+나군 13=41명."
    }
  ]
}
