{
  "university_id": "sookmyung",
  "university": "숙명여자대학교",
  "region": "서울",
  "tracks": [
    {
      "track_id": "sookmyung_susi_gihoe",
      "track_name": "학생부종합(기회균형전형)",
      "phase": "susi",
      "admission_basis": "학생부종합",
      "rural_type": "included",
      "rural_eligible_groups": ["국가보훈대상자", "기초생활수급자 및 차상위계층", "농어촌학생", "자립지원대상자"],
      "selection_elements": ["서류 100%"],
      "has_interview": false,
      "interview_note": "없음",
      "csat_minimum": false,
      "csat_minimum_detail": "미적용",
      "unit_note": "정원 내 55명. 국가보훈·기초수급자·농어촌·자립지원 통합 전형. 농어촌 단독 인원 미상.",
      "description": "수시 학생부종합 기회균형전형(정원 내). 서류100%, 수능최저 없음. 4개 그룹 통합 55명."
    },
    {
      "track_id": "sookmyung_susi_rural",
      "track_name": "학생부종합(농어촌학생전형)",
      "phase": "susi",
      "admission_basis": "학생부종합",
      "rural_type": "standalone",
      "rural_eligible_groups": ["농어촌학생"],
      "selection_elements": ["서류 100%"],
      "has_interview": false,
      "interview_note": "없음",
      "csat_minimum": false,
      "csat_minimum_detail": "미적용",
      "unit_note": "정원 외 63명. 미충원 인원은 정시 수능(농어촌학생전형) 가군으로 이월.",
      "description": "수시 학생부종합 농어촌학생 단독 전형(정원 외). 서류100%, 수능최저 없음. 63명."
    }
  ]
}
