{
  "university_id": "hongik",
  "university": "홍익대학교",
  "region": "서울",
  "tracks": [
    {
      "track_id": "hongik_susi_rural",
      "track_name": "학생부위주(교과)/실기위주 농어촌학생전형",
      "phase": "susi",
      "admission_basis": "학생부교과",
      "rural_type": "standalone",
      "rural_eligible_groups": ["농어촌학생"],
      "selection_elements": ["학생부교과 95% + 비교과(출결) 5% (인문·자연·예술학과)", "1단계 서류 100%(2배수) + 2단계 교과 40%·실기 60% (미술계열)"],
      "has_interview": false,
      "interview_note": "없음",
      "csat_minimum": false,
      "csat_minimum_detail": "미적용",
      "unit_note": "정원 외 40명 (서울캠퍼스). 인문·자연·예술학과는 교과95%+출결5%, 미술계열은 2단계 실기전형.",
      "description": "수시 농어촌학생 단독 전형(정원 외, 서울캠퍼스). 인문·자연 교과95%+출결5%, 미술계열 서류·실기 혼합. 수능최저 없음. 40명."
    },
    {
      "track_id": "hongik_jeongsi_rural",
      "track_name": "수능우수자(농어촌학생)",
      "phase": "jeongsi",
      "admission_basis": "수능",
      "rural_type": "standalone",
      "rural_eligible_groups": ["농어촌학생"],
      "selection_elements": ["수능 100%"],
      "has_interview": false,
      "interview_note": "없음",
      "csat_minimum": false,
      "csat_minimum_detail": "미적용",
      "unit_note": "정원 외 46명 (서울캠퍼스). 다군(㉰군) 중심.",
      "description": "정시 다군 농어촌학생 단독 전형(정원 외, 서울캠퍼스). 수능100%, 수능최저 없음. 46명."
    }
  ]
}
