{
  "university_id": "hufs",
  "university": "한국외국어대학교",
  "region": "서울",
  "tracks": [
    {
      "track_id": "hufs_susi_gihoe",
      "track_name": "학생부종합(기회균형전형)",
      "phase": "susi",
      "admission_basis": "학생부종합",
      "rural_type": "included",
      "rural_eligible_groups": ["기초생활수급자 및 차상위계층", "국가보훈대상자", "농어촌학생", "서해5도학생"],
      "selection_elements": ["서류평가 100% (일괄합산)"],
      "has_interview": false,
      "interview_note": "없음",
      "csat_minimum": false,
      "csat_minimum_detail": "미적용",
      "unit_note": "서울·글로벌 캠퍼스 합산 189명. 농어촌 단독 인원 미상(기초·국가보훈·농어촌·서해5도 합산). 서울 캠퍼스 단독 미제공.",
      "description": "기초생활·국가보훈·농어촌·서해5도 통합 기회균형 전형. 서류100%, 면접·수능최저 없음. 서울·글로벌 양 캠퍼스 합산 189명."
    },
    {
      "track_id": "hufs_jeongsi_rural",
      "track_name": "수능(농어촌학생 특별전형)",
      "phase": "jeongsi",
      "admission_basis": "수능",
      "rural_type": "standalone",
      "rural_eligible_groups": ["농어촌학생"],
      "selection_elements": ["수능 100%"],
      "has_interview": false,
      "interview_note": "없음",
      "csat_minimum": false,
      "csat_minimum_detail": "미적용",
      "unit_note": "서울·글로벌 캠퍼스 합산 101명 (정원 외). 나군. 서울 캠퍼스 단독 인원은 모집단위별 '이내' 방식 제공, 합산 불가.",
      "description": "정시 나군 농어촌학생 단독 특별전형(정원 외). 수능100%, 수능최저 없음. 서울·글로벌 양 캠퍼스 합산 101명."
    }
  ]
}
