{
  "university_id": "seoulwomen",
  "university": "서울여자대학교",
  "region": "서울",
  "tracks": [
    {
      "track_id": "seoulwomen_susi_gihoe",
      "track_name": "학생부종합(기회균형전형_사회통합지원)",
      "phase": "susi",
      "admission_basis": "학생부종합",
      "rural_type": "included",
      "rural_eligible_groups": ["기초생활수급자·차상위·한부모", "국가보훈대상자", "자립지원대상아동", "농어촌학생"],
      "selection_elements": ["서류(학생부) 100%"],
      "has_interview": false,
      "interview_note": "없음",
      "csat_minimum": false,
      "csat_minimum_detail": "미적용",
      "unit_note": "정원 내 61명. 기초차상위한부모·국가보훈·자립지원·농어촌학생 4개 그룹 통합 전형. 농어촌 단독 인원 미상. 농어촌은 12년형만 허용.",
      "description": "수시 학생부종합 기회균형전형_사회통합지원(정원 내). 서류(학생부)100% 일괄합산, 수능최저 없음. 4개 그룹 통합 61명."
    },
    {
      "track_id": "seoulwomen_susi_rural",
      "track_name": "학생부종합(기회균형전형_농어촌학생)",
      "phase": "susi",
      "admission_basis": "학생부종합",
      "rural_type": "standalone",
      "rural_eligible_groups": ["농어촌학생"],
      "selection_elements": ["서류(학생부) 100%"],
      "has_interview": false,
      "interview_note": "없음",
      "csat_minimum": false,
      "csat_minimum_detail": "미적용",
      "unit_note": "정원 외 63명. 12년형만 허용(6년형 불가). 읍·면 소재 특수목적고 출신자 지원 불가. 정시 농어촌학생전형은 수시 미충원 이월만.",
      "description": "수시 학생부종합 기회균형전형_농어촌학생(정원 외). 서류(학생부)100% 일괄합산, 수능최저 없음. 63명. 12년형만."
    }
  ]
}
