{
  "university_id": "soongsil",
  "university": "숭실대학교",
  "region": "서울",
  "tracks": [
    {
      "track_id": "soongsil_susi_gihoe",
      "track_name": "학생부종합(기회균형전형)",
      "phase": "susi",
      "admission_basis": "학생부종합",
      "rural_type": "included",
      "rural_eligible_groups": ["국가보훈대상자", "농어촌학생", "서해5도학생", "특성화고교 졸업자", "기초생활수급자 및 차상위계층", "자립지원대상자"],
      "selection_elements": ["1단계: 서류 100%(3배수)", "2단계: 1단계 50% + 면접 50%"],
      "has_interview": true,
      "interview_note": "2단계 서류기반 면접",
      "csat_minimum": false,
      "csat_minimum_detail": "미적용",
      "unit_note": "정원 내 130명. 국가보훈·농어촌·서해5도·특성화고·기초차상위·자립지원 통합 전형. 농어촌 단독 인원 미상.",
      "description": "수시 학생부종합 기회균형전형(정원 내). 1단계 서류100%(3배수), 2단계 1단계50%+면접50%. 수능최저 없음. 6개 그룹 통합 130명."
    },
    {
      "track_id": "soongsil_jeongsi_rural",
      "track_name": "수능(정원외특별전형-농어촌학생)",
      "phase": "jeongsi",
      "admission_basis": "수능",
      "rural_type": "standalone",
      "rural_eligible_groups": ["농어촌학생"],
      "selection_elements": ["수능 100%"],
      "has_interview": false,
      "interview_note": "없음",
      "csat_minimum": false,
      "csat_minimum_detail": "미적용",
      "unit_note": "정원 외 94명. 가군 48명·나군 10명·다군 36명.",
      "description": "정시 농어촌학생 단독 전형(정원 외). 수능100%, 수능최저 없음. 가군 48+나군 10+다군 36=94명."
    }
  ]
}
